{
  "$schema": "https://json-schema.org/draft/2020-12/schema",
  "$id": "https://schemas.substrate.dev/lift/pack/component_map.v1.json",
  "title": "Substrate Lift Component Map Pack v1",
  "type": "object",
  "required": ["kind", "version", "id", "name", "counting", "components"],
  "properties": {
    "kind": {
      "const": "component_map"
    },
    "version": {
      "const": 1
    },
    "id": {
      "$ref": "common.v1.json#/$defs/pack_name"
    },
    "name": {
      "type": "string",
      "minLength": 1
    },
    "description": {
      "type": "string"
    },
    "counting": {
      "$ref": "#/$defs/counting"
    },
    "components": {
      "type": "array",
      "items": {
        "$ref": "#/$defs/component"
      }
    }
  },
  "$defs": {
    "counting": {
      "type": "object",
      "required": ["mode"],
      "properties": {
        "mode": {
          "type": "string",
          "enum": ["distinct"]
        }
      },
      "additionalProperties": false
    },
    "component": {
      "type": "object",
      "required": ["id", "label", "include"],
      "properties": {
        "id": {
          "type": "string",
          "minLength": 1
        },
        "label": {
          "type": "string",
          "minLength": 1
        },
        "include": {
          "$ref": "common.v1.json#/$defs/glob_list"
        },
        "exclude": {
          "$ref": "common.v1.json#/$defs/glob_list"
        },
        "tags": {
          "type": "array",
          "items": {
            "type": "string"
          }
        }
      },
      "additionalProperties": false
    }
  },
  "additionalProperties": false
}
